{
  "format_version": 1,
  "provider": "local",
  "language": "en",
  "entries": {
    "choose-a-path": {
      "text": "Choose a path"
    },
    "continue": {
      "text": "Continue"
    },
    "effect-completed": {
      "text": "Effect completed"
    },
    "hello": {
      "text": "Hello"
    },
    "hidden": {
      "text": "Hidden"
    },
    "inside-callee": {
      "text": "Inside callee"
    },
    "narrator": {
      "text": "Narrator"
    },
    "scene-ready": {
      "text": "Scene ready"
    },
    "unexpected-branch": {
      "text": "Unexpected branch"
    }
  }
}
